{
  "webhook_queue_event_id": "123e4567-e89b-12d3-a456-426614174000",
  "organization_id": "2f26d0e1-9158-4685-83e8-1660c27e4c3f",
  "environment": "production",
  "webhook_id": "274b2899-7957-464b-a609-49939039cd49",
  "created_at": "2023-04-01T12:00:00Z",
  "status": "queued",
  "subscription": "policy_issued",
  "attempts_count": 2,
  "last_attempt_at": "2023-04-01T12:00:02Z",
  "last_response_code": 500,
  "body": {
    "webhook_id": "274b2899-7957-464b-a609-49939039cd49",
    "event": {
      "type": "policy_issued",
      "policy_id": "abc123"
    },
    "verification_token": "optional_token_123",
    "environment": "production"
  },
  "url": "http://yoururlhere.com"
}